<?xml version="1.0" encoding="UTF-8" standalone="yes"?>
<acta xmlns="http://www.um.es/acta" xmlns:xsi="http://www.w3.org/2001/XMLSchema-instance" asignatura="1902" convocatoria="febrero" curso="2020" xsi:schemaLocation="http://www.um.es/acta acta.xsd">
    <calificacion>
        <nif>23322156M</nif>
        <nota>10.0</nota>
    </calificacion>
    <calificacion>
        <nif>13322156M</nif>
        <nombre>Pepe</nombre>
        <nota>8.5</nota>
    </calificacion>
    <diligencia fecha="2021-02-05">
        <nif>13322156M</nif>
        <nota>9.5</nota>
    </diligencia>
</acta>
